,Name of bill,Bill no.,Stage,Last activity,Select Committee
23,Education Amendment Bill (No 4)  Bill - government,279-2,RA,29 August 2011,Education and Science Committee
24,Freedom Camping Bill  Bill - government,306-2,RA,29 August 2011,Local Government and Environment Committee
25,Duties of Statutory Officers (Census and Other Remedial Provisions) Bill  Bill - government,313-1,RA,29 August 2011,
26,Policing (Storage of Youth Identifying Particulars) Amendment Bill  Bill - government,317-1,RA,29 August 2011,
27,Aquaculture Legislation Amendment Bill (No 3)  Bill - government,239-2,3,18 August 2011,Primary Production Committee
28,Electoral (Administration) Amendment Bill (No 2)  Bill - government,247-3,RA,16 August 2011,Justice and Electoral Committee
29,Domestic Violence Amendment Bill (No 2)  Bill - government,72-3A,RA,16 August 2011,
30,Care of Children Amendment Bill  Bill - government,72-3B,RA,16 August 2011,
31,Adoption Amendment Bill  Bill - government,72-3C,RA,16 August 2011,
32,Appropriation (2011/12 Estimates) Bill  Bill - government,308-1,RA,12 August 2011,
33,Imprest Supply (Second for 2011/12) Bill  Bill - government,314-1,RA,12 August 2011,
34,Child and Family Protection Bill  Bill - government,72-2,3,10 August 2011,Justice and Electoral Committee
35,Misuse of Drugs Amendment Bill  Bill - government,126-3,RA,08 August 2011,Health Committee
36,Weathertight Homes Resolution Services (Financial Assistance Package) Amendment Bill  Bill - government,258-3,RA,22 July 2011,Local Government and Environment Committee
37,Smoke-free Environments (Controls and Enforcement) Amendment Bill  Bill - government,267-2,RA,22 July 2011,Health Committee
38,District Courts Amendment Bill  Bill - government,147-3A,RA,22 July 2011,
39,Land Transport Amendment Bill  Bill - government,147-3B,RA,22 July 2011,
40,Summary Proceedings Amendment Bill (No 3)  Bill - government,147-3C,RA,22 July 2011,
41,"Children, Young Persons, and Their Families Amendment Bill (No 2)  Bill - government",147-3D,RA,22 July 2011,
42,Crimes Amendment Bill (No 4)  Bill - government,147-3E,RA,22 July 2011,
43,Criminal Proceeds (Recovery) Amendment Bill  Bill - government,147-3F,RA,22 July 2011,
44,Customs and Excise Amendment Bill (No 2)  Bill - government,147-3G,RA,22 July 2011,
45,Disputes Tribunals Amendment Bill (No 2)  Bill - government,147-3H,RA,22 July 2011,
46,Family Courts Amendment Bill  Bill - government,147-3I,RA,22 July 2011,
47,Immigration Amendment Bill  Bill - government,147-3J,RA,22 July 2011,
48,Misuse of Drugs Amendment Bill (No 3)  Bill - government,147-3K,RA,22 July 2011,
49,Misuse of Drugs Amendment Act 1978 Amendment Bill  Bill - government,147-3L,RA,22 July 2011,
0,Personal Property Securities Amendment Bill (No 2)  Bill - government,147-3M,RA,22 July 2011,
1,Prisoners’ and Victims’ Claims Amendment Bill  Bill - government,147-3N,RA,22 July 2011,
2,Privacy Amendment Bill (No 2)  Bill - government,147-3O,RA,22 July 2011,
3,Railways Amendment Bill  Bill - government,147-3P,RA,22 July 2011,
4,Residential Tenancies Amendment Bill (No 3)  Bill - government,147-3Q,RA,22 July 2011,
5,Sentencing Amendment Bill (No 5)  Bill - government,147-3R,RA,22 July 2011,
6,Social Security Amendment Bill (No 4)  Bill - government,147-3S,RA,22 July 2011,
7,Tax Administration Amendment Bill  Bill - government,147-3T,RA,22 July 2011,
8,Whanganui Iwi (Whanganui (Kaitoke) Prison and Northern Part of Whanganui Forest) On-account Settlement Bill  Bill - government,67-2,,22 July 2011,Māori Affairs Committee
9,Television New Zealand Amendment Bill  Bill - government,89-2,RA,22 July 2011,Commerce Committee
10,New Zealand Security Intelligence Service Amendment Bill  Bill - government,259-3,RA,12 July 2011,
11,Crimes Amendment Bill (No 3)  Bill - government,259-3A,RA,12 July 2011,
12,New Zealand Security Intelligence Service Amendment Bill  Bill - government,259-3,,12 July 2011,
13,Courts and Criminal Matters Bill  Bill - government,147-2,3,05 July 2011,Law and Order Committee
14,"Telecommunications (TSO, Broadband, and Other Matters) Amendment Bill  Bill - government",250-3,RA,30 June 2011,Finance and Expenditure Committee
15,Appropriation (2010/11 Supplementary Estimates) Bill  Bill - government,307-1,RA,27 June 2011,
16,Imprest Supply (First for 2011/12) Bill  Bill - government,309-1,RA,27 June 2011,
17,Westpac New Zealand Bill  Bill - private,255-2,RA,17 June 2011,Finance and Expenditure Committee
18,Taxation (Canterbury Earthquake Measures) Bill  Bill - government,288-1,RA,24 May 2011,
19,Taxation (Annual Rates and Budget Measures) Bill  Bill - government,305-1,RA,24 May 2011,
20,Auditor Regulation Bill  Bill - government,214-3A,RA,19 May 2011,
21,Financial Reporting Amendment Bill  Bill - government,214-3B,RA,19 May 2011,
22,Dairy Industry Restructuring (New Sunset Provisions) Amendment Bill  Bill - government,223-2,RA,17 May 2011,Primary Production Committee
23,Climate Change Response Amendment Bill  Bill - government,246-3A,RA,17 May 2011,
24,Imports and Exports (Restrictions) Amendment Bill  Bill - government,246-3C,RA,17 May 2011,
25,Hazardous Substances and New Organisms Amendment Bill (No 2)  Bill - government,246-3B,RA,17 May 2011,
26,Ozone Layer Protection Amendment Bill  Bill - government,246-3D,RA,17 May 2011,
27,Resource Management Amendment Bill  Bill - government,246-3E,RA,17 May 2011,
28,Environmental Protection Authority Bill  Bill - government,246-3,RA,17 May 2011,Local Government and Environment Committee
29,Land Transport (Driver Licensing) Amendment Bill  Bill - government,156-1,CH,10 May 2011,Transport and Industrial Relations Committee
30,Land Transport (Road Safety and Other Matters) Amendment Bill  Bill - government,213-3,RA,09 May 2011,Transport and Industrial Relations Committee
31,Hamilton City Council (Parana Park) Land Vesting Bill  Bill - local,154-2,RA,05 May 2011,Local Government and Environment Committee
32,Auditor Regulation and External Reporting Bill  Bill - government,214-2,3,03 May 2011,Commerce Committee
33,Financial Markets Authority Bill  Bill - government,211-3A,RA,18 April 2011,
34,Securities Amendment Bill (No 3)  Bill - government,211-3B,RA,18 April 2011,
35,Securities Markets Amendment Bill (No 2)  Bill - government,211-3C,RA,18 April 2011,
36,KiwiSaver Amendment Bill  Bill - government,211-3D,RA,18 April 2011,
37,Financial Advisers Amendment Bill (No 3)  Bill - government,211-3E,RA,18 April 2011,
38,Canterbury Earthquake Recovery Bill  Bill - government,286-1,RA,18 April 2011,
39,Securities Trustees and Statutory Supervisors Bill  Bill - government,114-3,RA,18 April 2011,Commerce Committee
40,Copyright (Infringing File Sharing) Amendment Bill  Bill - government,119-2,RA,18 April 2011,Commerce Committee
41,Foreshore and Seabed Act (Repeal) Bill  Bill - member's,86-1,SC,13 April 2011,
42,Legal Services Bill  Bill - government,189-2,RA,11 April 2011,Justice and Electoral Committee
43,Financial Markets (Regulators and KiwiSaver) Bill  Bill - government,211-2,3,05 April 2011,Commerce Committee
44,Marine and Coastal Area (Takutai Moana) Bill  Bill - government,201-2,RA,31 March 2011,Māori Affairs Committee
45,Appropriation (2009/10 Financial Review) Bill  Bill - government,265-1,RA,24 March 2011,
46,Regulatory Responsibility Bill  Bill - member's,71-1,CH,17 March 2011,Commerce Committee
47,Canterbury Earthquake Commemoration Day Bill  Bill - government,276-1,RA,14 March 2011,
48,Energy Efficiency and Conservation Amendment Bill  Bill - government,263-1,SC,01 March 2011,
49,Rail Network Bill  Bill - government,251-2,CH,25 January 2011,Government Administration Committee
0,Education Amendment Bill (No 2)  Bill - government,169-2,RA,20 December 2010,Education and Science Committee
1,New Zealand Productivity Commission Bill  Bill - government,179-2,RA,20 December 2010,Commerce Committee
2,Parliamentary Service Amendment Bill  Bill - government,186-2,RA,20 December 2010,Electoral Legislation Committee
3,Taxation (GST and Remedial Matters) Bill  Bill - government,182-2,RA,20 December 2010,Finance and Expenditure Committee
4,"Research, Science, and Technology Bill  Bill - government",,RA,20 December 2010,
5,National Library of New Zealand (Te Puna Mātauranga o Aotearoa) Amendment Bill  Bill - government,,RA,20 December 2010,
6,Public Records Amendment Bill (No 2)  Bill - government,,RA,20 December 2010,
7,Health and Safety in Employment Amendment Bill  Bill - government,,RA,20 December 2010,
8,Electoral Referendum Bill  Bill - government,128-2,RA,20 December 2010,Electoral Legislation Committee
9,Electoral (Finance Reform and Advance Voting) Amendment Bill  Bill - government,146-3,RA,20 December 2010,Electoral Legislation Committee
10,Sale and Supply of Liquor and Liquor Enforcement Bill  Bill - government,254-1,CH,17 December 2010,Justice and Electoral Committee
11,Ngāti Apa (North Island) Claims Settlement Bill  Bill - government,68-3,RA,15 December 2010,Māori Affairs Committee
12,Electoral (Disqualification of Sentenced Prisoners) Amendment Bill  Bill - member's,117-3,,15 December 2010,Law and Order Committee
13,State Sector Management Bill  Bill - government,193-2,3,11 December 2010,Education and Science Committee
14,Holidays Amendment Bill  Bill - government,195-3,RA,26 November 2010,Transport and Industrial Relations Committee
15,Employment Relations Amendment Bill (No 2)  Bill - government,196-3,RA,26 November 2010,Transport and Industrial Relations Committee
16,Subordinate Legislation (Confirmation and Validation) Bill (No 2)  Bill - government,220-1,RA,26 November 2010,Regulations Review Committee
17,Local Government Act 2002 Amendment Bill  Bill - government,142-2,RA,26 November 2010,Local Government and Environment Committee
18,Rugby World Cup 2011 (Empowering) Bill  Bill - government,135-3,RA,22 November 2010,Government Administration Committee
19,Governor-General Bill  Bill - government,163-2,RA,22 November 2010,Government Administration Committee
20,Aquaculture Legislation Amendment Bill (No 2)  Bill - government,242-2,CH,17 November 2010,Primary Production Committee
21,Animal Welfare (Treatment of Animals) Amendment Bill  Bill - member's,190-1,W,10 November 2010,
22,Employment Relations (Film Production Work) Amendment Bill  Bill - government,229-1,RA,29 October 2010,
23,Summary Proceedings Amendment Bill (No 2)  Bill - government,228-1,RA,29 October 2010,
24,Human Rights (Disability Commissioner) Amendment Bill  Bill - member's,192-1,SC,27 October 2010,
25,"Ngati Tuwharetoa, Raukawa, and Te Arawa River Iwi Waikato River Bill  Bill - government",143-3,RA,26 October 2010,Māori Affairs Committee
26,Christ's College (Canterbury) Amendment Bill  Bill - private,108-2,RA,23 October 2010,Government Administration Committee
27,New Zealand Public Health and Disability Amendment Bill  Bill - government,134-3,RA,23 October 2010,Health Committee
28,Human Assisted Reproductive Technology (Storage) Amendment Bill  Bill - government,88-2,RA,15 October 2010,Health Committee
29,Electricity Industry Bill  Bill - government,111-3,RA,05 October 2010,Finance and Expenditure Committee
30,Sale of Liquor (Objections to Applications) Amendment Bill  Bill - member's,230-1,W,22 September 2010,Social Services Committee
31,Franklin District Council (Contribution to Funding of Museums) Amendment Bill  Bill - local,266-1,W,22 September 2010,Local Government and Environment Committee
32,Private Security Personnel and Private Investigators Bill  Bill - government,297-3,RA,20 September 2010,Justice and Electoral Committee
33,Canterbury Earthquake Response and Recovery Bill  Bill - government,215-1,RA,14 September 2010,
34,Electricity (Continuance of Supply) Amendment Bill  Bill - government,296-2,CH,08 September 2010,Commerce Committee
35,Crimes (Reasonable Parental Control and Correction) Amendment Bill  Bill - member's,78-1,W,08 September 2010,
36,Goods and Services Tax (Exemption of Healthy Food) Amendment Bill  Bill - member's,140-1,W,08 September 2010,
37,Privacy (Cross-border Information) Amendment Bill  Bill - government,221-2,RA,07 September 2010,Justice and Electoral Committee
38,Motor Vehicle Sales Amendment Bill  Bill - government,39-2,RA,07 September 2010,Commerce Committee
39,Limitation Bill  Bill - government,33-2,RA,07 September 2010,Justice and Electoral Committee
40,Insurance (Prudential Supervision) Bill  Bill - government,95-2,RA,07 September 2010,Finance and Expenditure Committee
41,"Taxation (Annual Rates, Trans-Tasman Savings Portability, KiwiSaver, and Remedial Matters) Bill  Bill - government",100-2,RA,07 September 2010,Finance and Expenditure Committee
42,Trans-Tasman Proceedings Bill  Bill - government,105-2,RA,31 August 2010,Justice and Electoral Committee
43,"Tariff (New Zealand-Hong Kong, China Closer Economic Partnership Agreement) Amendment Bill  Bill - government",148-1,RA,31 August 2010,"Foreign Affairs, Defence and Trade Committee"
44,"Children, Young Persons, and Their Families Amendment Bill  Bill - government",125-3A,RA,23 August 2010,
45,Education Amendment Bill (No 3)  Bill - government,125-3B,RA,23 August 2010,
46,Taxation (Definitions of Dependent Child) Bill  Bill - government,125-3C,RA,23 August 2010,
47,"Social Security (New Work Tests, Incentives, and Obligations) Amendment Bill  Bill - government",125-3D,RA,23 August 2010,
48,War Pensions Amendment Bill (No 3)  Bill - government,125-3E,RA,23 August 2010,
49,"Social Assistance (New Work Tests, Incentives, and Obligations) Amendment Bill  Bill - government",125-2,,17 August 2010,Social Services Committee
0,Utilities Access Bill  Bill - government,63-3A,RA,05 August 2010,
1,Infrastructure (Amendments Relating to Utilities Access) Bill  Bill - government,63-3B,RA,05 August 2010,
2,New Zealand Railways Corporation Amendment Bill  Bill - government,63-3C,RA,05 August 2010,
3,Affordable Housing: Enabling Territorial Authorities Act Repeal Bill  Bill - government,63-3D,RA,05 August 2010,
4,Imprest Supply (Second for 2010/11) Bill  Bill - government,188-1,RA,05 August 2010,
5,Appropriation (2010/11 Estimates) Bill  Bill - government,158-1,RA,05 August 2010,
6,Education (Board of Trustee Freedom) Amendment Bill  Bill - member's,172-1,W,04 August 2010,
7,Employment Relations (Probationary Period Repeal) Amendment Bill  Bill - member's,174-1,W,04 August 2010,
8,Resource Management (Enhancement of Iwi Management Plans) Amendment Bill  Bill - member's,87-1,W,04 August 2010,
9,Ethical Investment (Crown Financial Institutions) Bill  Bill - member's,149-1,W,04 August 2010,
10,Infrastructure Bill  Bill - government,63-2,3,29 July 2010,Transport and Industrial Relations Committee
11,Residential Tenancies Amendment Bill  Bill - government,34-3,RA,22 July 2010,Social Services Committee
12,Rodney District Council Bill  Bill - local,170-1,W,21 July 2010,
13,Public Works (Offer Back of and Compensation for Acquired Land) Amendment Bill  Bill - member's,139-1,W,21 July 2010,Local Government and Environment Committee
14,Credit Reforms (Responsible Lending) Bill  Bill - member's,73-1,W,21 July 2010,
15,Agricultural Compounds and Veterinary Medicines Amendment Bill  Bill - government,,RA,06 July 2010,
16,Animal Products Amendment Bill  Bill - government,,RA,06 July 2010,
17,Armed Forces Discipline Amendment Bill  Bill - government,,RA,06 July 2010,
18,"Births, Deaths, Marriages, and Relationships Registration Amendment Bill  Bill - government",,RA,06 July 2010,
19,Building Amendment Bill  Bill - government,,RA,06 July 2010,
20,Charitable Trusts Amendment Bill  Bill - government,,RA,06 July 2010,
21,Chatham Islands Council Amendment Bill  Bill - government,,RA,06 July 2010,
22,Companies Amendment Bill (No 2)  Bill - government,,RA,06 July 2010,
23,Conservation Amendment Bill (No 2)  Bill - government,,RA,06 July 2010,
24,Copyright Amendment Bill  Bill - government,,RA,06 July 2010,
25,Coroners Amendment Bill  Bill - government,,RA,06 July 2010,
26,Court Martial Amendment Bill  Bill - government,,RA,06 July 2010,
27,Court Martial Appeals Amendment Bill  Bill - government,,RA,06 July 2010,
28,"Crimes (Internationally Protected Persons, United Nations and Associated Personnel, and Hostages) Amendment Bill  Bill - government",,RA,06 July 2010,
29,Crown Entities Amendment Bill  Bill - government,,RA,06 July 2010,
30,Defence Amendment Bill  Bill - government,,RA,06 July 2010,
31,Dog Control Amendment Bill  Bill - government,,RA,06 July 2010,
32,Electoral Amendment Bill (No 2)  Bill - government,,RA,06 July 2010,
33,Epidemic Preparedness Amendment Bill  Bill - government,,RA,06 July 2010,
34,Fire Service Amendment Bill  Bill - government,,RA,06 July 2010,
35,"Flags, Emblems, and Names Protection Amendment Bill  Bill - government",,RA,06 July 2010,
36,Immigration Advisers Licensing Amendment Bill  Bill - government,,RA,06 July 2010,
37,Incorporated Societies Amendment Bill  Bill - government,,RA,06 July 2010,
38,Insolvency Amendment Bill (No 2)  Bill - government,,RA,06 July 2010,
39,Juries Amendment Act 2008 Amendment Bill  Bill - government,,RA,06 July 2010,
40,Marriage Amendment Bill  Bill - government,,RA,06 July 2010,
41,Misuse of Drugs Amendment Bill (No 2)  Bill - government,,RA,06 July 2010,
42,National Parks Amendment Bill  Bill - government,,RA,06 July 2010,
43,New Zealand Institute of Chartered Accountants Amendment Bill  Bill - government,,RA,06 July 2010,
44,New Zealand Superannuation and Retirement Income Amendment Bill (No 3)  Bill - government,,RA,06 July 2010,
45,Property Law Amendment Bill  Bill - government,,RA,06 July 2010,
46,Protection of Personal and Property Rights Amendment Bill  Bill - government,,RA,06 July 2010,
47,Public Finance Amendment Bill  Bill - government,,RA,06 July 2010,
48,Public Records Amendment Bill  Bill - government,,RA,06 July 2010,
49,Radiocommunications Amendment Bill  Bill - government,,RA,06 July 2010,
0,Rates Rebate Amendment Bill  Bill - government,,RA,06 July 2010,
1,Real Estate Agents Amendment Bill  Bill - government,,RA,06 July 2010,
2,Securities Amendment Bill (No 2)  Bill - government,,RA,06 July 2010,
3,Sentencing Amendment Bill (No 4)  Bill - government,,RA,06 July 2010,
4,Social Security Amendment Bill (No 2)  Bill - government,,RA,06 July 2010,
5,Statistics Amendment Bill  Bill - government,,RA,06 July 2010,
6,Summary Proceedings Amendment Bill  Bill - government,,RA,06 July 2010,
7,Takeovers Amendment Bill  Bill - government,,RA,06 July 2010,
8,Taratahi Agricultural Training Centre (Wairarapa) Amendment Bill  Bill - government,,RA,06 July 2010,
9,Telecommunications Amendment Bill  Bill - government,,RA,06 July 2010,
10,Trans-Tasman Mutual Recognition Amendment Bill  Bill - government,,RA,06 July 2010,
11,Wild Animal Control Amendment Bill  Bill - government,,RA,06 July 2010,
12,Dog Control Amendment Bill (No 2)  Bill - government,176-2,CH,06 July 2010,Local Government and Environment Committee
13,Courts (Remote Participation) Bill  Bill - government,107-3,RA,06 July 2010,Justice and Electoral Committee
14,Animal Welfare Amendment Bill  Bill - government,118-2,RA,06 July 2010,Primary Production Committee
15,Financial Advisers Amendment Bill (No 2)  Bill - government,,RA,30 June 2010,
16,Financial Service Providers (Registration and Dispute Resolution) Amendment Bill  Bill - government,,RA,30 June 2010,
17,Tariff (Malaysia Free Trade Agreement) Amendment Bill  Bill - government,116-1,RA,30 June 2010,"Foreign Affairs, Defence and Trade Committee"
18,Prisoners' and Victims' Claims (Expiry and Application Dates) Amendment Bill  Bill - government,136-1,RA,30 June 2010,Justice and Electoral Committee
19,Civil Aviation (Cape Town Convention and Other Matters) Amendment Bill  Bill - government,166-1,RA,30 June 2010,
20,Policing (Involvement in Local Authority Elections) Amendment Bill  Bill - government,168-1,RA,30 June 2010,
21,Statutes Amendment Bill  Bill - government,101-1,3,29 June 2010,Government Administration Committee
22,Imprest Supply (First for 2010/11) Bill  Bill - government,178-1,RA,24 June 2010,
23,Appropriation (2009/10 Supplementary Estimates) Bill  Bill - government,157-1,RA,24 June 2010,
24,Financial Service Providers (Pre-Implementation Adjustments) Bill  Bill - government,109-2,3,23 June 2010,Commerce Committee
25,Electricity (Renewable Preference) Amendment Bill  Bill - member's,150-1,W,16 June 2010,
26,Local Electoral (Māori Representation) Amendment Bill  Bill - member's,151-1,W,16 June 2010,
27,Local Government (Auckland Transitional Provisions) Bill  Bill - government,112-3C,RA,14 June 2010,
28,Local Government (Tamaki Makaurau Reorganisation) Amendment Bill  Bill - government,112-3A,RA,14 June 2010,
29,Local Government (Auckland Council) Amendment Bill  Bill - government,112-3B,RA,14 June 2010,
30,Local Government (Auckland Law Reform) Bill  Bill - government,112-2,3,02 June 2010,Auckland Governance Legislation Committee
31,Oaths Modernisation Bill  Bill - government,264-1,CH,01 June 2010,Government Administration Committee
32,Sentencing and Parole Reform Bill  Bill - government,17-3,RA,31 May 2010,Law and Order Committee
33,Carter Observatory Act Repeal Bill  Bill - government,66-1,RA,31 May 2010,Education and Science Committee
34,Taxation (Budget Measures) Bill  Bill - government,155-1,RA,27 May 2010,
35,War Pensions Amendment Bill (No 2)  Bill - government,,RA,27 May 2010,
36,Government Superannuation Fund Amendment Act 1969 Amendment Bill  Bill - government,,RA,27 May 2010,
37,National Provident Fund Restructuring Amendment Bill  Bill - government,,RA,27 May 2010,
38,Social Security Amendment Bill  Bill - government,,RA,27 May 2010,
39,New Zealand Superannuation and Retirement Income Amendment Bill (No 2)  Bill - government,,RA,27 May 2010,
40,Electoral (Administration) Amendment Bill  Bill - government,93-2,RA,21 May 2010,Justice and Electoral Committee
41,Education Amendment Bill  Bill - government,25-2,RA,19 May 2010,Education and Science Committee
42,Waikato-Tainui Raupatu Claims (Waikato River) Settlement Bill  Bill - government,302-3,RA,07 May 2010,Māori Affairs Committee
43,Employment Relations (Statutory Minimum Redundancy Entitlements) Amendment Bill  Bill - member's,65-1,W,05 May 2010,
44,Smart Meters (Consumer Choice) Bill  Bill - member's,122-1,W,05 May 2010,
45,Tariff Act 1988 Repeal Bill  Bill - member's,137-1,W,05 May 2010,
46,Excise and Excise-equivalent Duties Table (Tobacco Products) Amendment Bill  Bill - government,145-1,RA,29 April 2010,
47,Head of State Referenda Bill  Bill - member's,92-1,W,21 April 2010,
48,Minimum Wage (Mitigation of Youth Unemployment) Amendment Bill  Bill - member's,123-1,W,21 April 2010,
49,Unit Titles Bill  Bill - government,212-3,RA,19 April 2010,Social Services Committee
0,Companies Amendment Bill  Bill - government,,RA,19 April 2010,
1,Conservation Amendment Bill  Bill - government,,RA,19 April 2010,
2,Designs Amendment Bill  Bill - government,,RA,19 April 2010,
3,Fisheries Amendment Bill  Bill - government,,RA,19 April 2010,
4,Gas Amendment Bill  Bill - government,,RA,19 April 2010,
5,Hazardous Substances and New Organisms Amendment Bill  Bill - government,,RA,19 April 2010,
6,Ministry of Agriculture and Fisheries (Restructuring) Amendment Bill  Bill - government,,RA,19 April 2010,
7,Reserves Amendment Bill  Bill - government,,RA,19 April 2010,
8,Weights and Measures Amendment Bill  Bill - government,,RA,19 April 2010,
9,Environment Canterbury (Temporary Commissioners and Improved Water Management) Bill  Bill - government,130-1,RA,12 April 2010,
10,Dairy Industry Restructuring (Raw Milk Pricing Methods) Bill  Bill - government,94-2,RA,08 April 2010,Primary Production Committee
11,Immigration Act 2009 Amendment Bill  Bill - government,129-1,RA,08 April 2010,
12,Regulatory Improvement Bill  Bill - government,298-2,3,01 April 2010,Commerce Committee
13,Maori Commercial Aquaculture Claims Settlement (Regional Agreements) Amendment Bill  Bill - government,31-2,RA,29 March 2010,Māori Affairs Committee
14,Appropriation (2008/09 Financial Review) Bill  Bill - government,110-1,RA,22 March 2010,
15,Judicial Conduct Commissioner and Judicial Conduct Panel (Deputy Commissioner and Disposal of Complaints) Amendment Bill  Bill - government,216-3A,RA,22 March 2010,
16,District Courts (District Court Judges) Amendment Bill  Bill - government,216-3B,RA,22 March 2010,
17,Judicature (Judicial Matters) Amendment Bill  Bill - government,216-3C,RA,22 March 2010,
18,Judicial Matters Bill  Bill - government,216-2,3,17 March 2010,Justice and Electoral Committee
19,Mental Health (Compulsory Assessment and Treatment) Amendment Bill  Bill - member's,113-1,W,17 March 2010,
20,Resource Management (Requiring Authorities) Amendment Bill  Bill - member's,115-1,W,17 March 2010,
21,"Children, Young Persons, and Their Families (Youth Courts Jurisdiction and Orders) Amendment Bill  Bill - government",16-2,RA,06 March 2010,Social Services Committee
22,Student Loan Scheme (Exemptions and Miscellaneous Provisions) Amendment Bill  Bill - government,59-2,RA,06 March 2010,Education and Science Committee
23,Accident Compensation Amendment Bill  Bill - government,90-2,,02 March 2010,Transport and Industrial Relations Committee
24,"Injury Prevention, Rehabilitation, and Compensation Amendment Bill  Bill - government",83-2,RA,24 February 2010,Transport and Industrial Relations Committee
25,Wanganui District Council (Port and Harbour) Bill  Bill - local,99-1,SC,16 February 2010,
