,Name of bill,Bill no.,Stage,Last activity,Select Committee
12,Radiocommunications Amendment Bill (No 4)  Bill - government,,RA,26 March 2008,
13,Reserves Amendment Bill  Bill - government,,RA,26 March 2008,
14,Summary Proceedings Amendment Bill (No 3)  Bill - government,,RA,26 March 2008,
15,Veterinarians Amendment Bill  Bill - government,,RA,26 March 2008,
16,Social Assistance (Debt Prevention and Minimisation) Amendment Bill  Bill - government,134-2,3,19 March 2008,Social Services Committee
17,Building Amendment Bill  Bill - government,128-2,RA,14 March 2008,Social Services Committee
18,Misuse of Drugs (Classification of BZP) Amendment Bill  Bill - government,146-2,RA,14 March 2008,Health Committee
19,Limited Partnerships Bill  Bill - government,140-3,RA,13 March 2008,Commerce Committee
20,Broadcasting Amendment Bill  Bill - government,149-2,RA,13 March 2008,Commerce Committee
21,Statutes Amendment Bill (No 2)  Bill - government,147-1,3,13 March 2008,Government Administration Committee
22,Taxation (Limited Partnerships) Bill  Bill - government,140-3A,RA,13 March 2008,
23,Maori Purposes Bill (No 2)  Bill - government,205-2,3,12 March 2008,Māori Affairs Committee
24,New Zealand Guardian Trust Company Amendment Bill  Bill - private,157-1,RA,21 February 2008,Finance and Expenditure Committee
25,Electoral Finance Bill  Bill - government,130-3,RA,19 December 2007,Justice and Electoral Committee
26,Broadcasting Amendment Bill (No 3)  Bill - government,130-3A,RA,19 December 2007,
27,Electoral Amendment Bill  Bill - government,130-3B,RA,19 December 2007,
28,Taxation (Annual Rates of Income Tax 2007-08) Bill  Bill - government,,RA,19 December 2007,
29,Taxation (Business Taxation and Remedial Matters) Bill  Bill - government,,RA,19 December 2007,
30,Taxation (KiwiSaver) Bill  Bill - government,,RA,19 December 2007,
31,Education (Tertiary Reforms) Amendment Bill  Bill - government,114-2,RA,14 December 2007,Education and Science Committee
32,Dairy Industry Restructuring Amendment Bill (No 2)  Bill - government,142-2,RA,14 December 2007,Primary Production Committee
33,"Taxation (Annual Rates, Business Taxation, KiwiSaver, and Remedial Matters) Bill  Bill - government",119-2,3,12 December 2007,Finance and Expenditure Committee
34,Employment Relations (Flexible Working Arrangements) Amendment Bill  Bill - member's,253-3,,26 November 2007,Transport and Industrial Relations Committee
35,Subordinate Legislation (Confirmation and Validation) Bill (No 3)  Bill - government,163-1,RA,26 November 2007,Regulations Review Committee
36,Appropriation (Continuation of Interim Meaning of Funding for Parliamentary Purposes) Bill  Bill - government,172-2,RA,26 November 2007,
37,New Zealand Bill of Rights (Private Property Rights) Amendment Bill  Bill - member's,255-1,W,21 November 2007,Justice and Electoral Committee
38,Terrorism Suppression Amendment Bill  Bill - government,105-3,RA,19 November 2007,"Foreign Affairs, Defence and Trade Committee"
39,Armed Forces Discipline Amendment Bill (No 2)  Bill - government,108-3A,RA,13 November 2007,
40,Court Martial Appeals Amendment Bill  Bill - government,108-3B,RA,13 November 2007,
41,Defence Amendment Bill (No 3)  Bill - government,108-3C,RA,13 November 2007,
42,Court Martial Bill  Bill - government,108-3D,RA,13 November 2007,
43,Human Tissue (Organ Donation) Amendment Bill  Bill - member's,33-1,W,07 November 2007,Health Committee
44,Principles of the Treaty of Waitangi Deletion Bill  Bill - member's,66-1,W,07 November 2007,Justice and Electoral Committee
45,Income Tax Bill  Bill - government,91-2,RA,01 November 2007,Finance and Expenditure Committee
46,Crimes (Repeal of Seditious Offences) Amendment Bill  Bill - government,120-1,RA,30 October 2007,Justice and Electoral Committee
47,Evidence Amendment Bill (No 2)  Bill - government,154-1,SC,24 October 2007,
48,Porirua City Council (Pauatahanui Burial Ground) Bill  Bill - local,125-1,RA,23 October 2007,Local Government and Environment Committee
49,Health (Drinking Water) Amendment Bill  Bill - government,52-3,RA,17 October 2007,Health Committee
0,Succession (Homicide) Bill  Bill - government,74-2,RA,17 October 2007,Justice and Electoral Committee
1,Arbitration Amendment Bill  Bill - government,72-2,RA,17 October 2007,Justice and Electoral Committee
2,Agricultural Compounds and Veterinary Medicines Amendment Bill  Bill - government,45-2,RA,17 October 2007,Primary Production Committee
3,Armed Forces Law Reform Bill  Bill - government,108-2,3,10 October 2007,"Foreign Affairs, Defence and Trade Committee"
4,Property Law Bill  Bill - government,89-3,RA,04 October 2007,Justice and Electoral Committee
5,Protection of Personal and Property Rights Amendment Bill  Bill - government,94-3,RA,25 September 2007,Social Services Committee
6,Aviation Crimes Amendment Bill  Bill - government,110-3A,RA,25 September 2007,
7,Civil Aviation Amendment Bill (No 2)  Bill - government,110-3B,RA,25 September 2007,
8,"Children, Young Persons, and Their Families Amendment Bill (No 4)  Bill - government",159-2,CH,20 September 2007,Social Services Committee
9,Education (Tertiary Reform) Amendment Bill  Bill - government,180-3A,RA,19 September 2007,
10,International Finance Agreements Amendment Bill  Bill - government,113-1,RA,19 September 2007,"Foreign Affairs, Defence and Trade Committee"
11,Animal Products Amendment Bill  Bill - government,,RA,19 September 2007,
12,Armed Forces Discipline Amendment Bill  Bill - government,,RA,19 September 2007,
13,Biosecurity Amendment Bill (No 2)  Bill - government,,RA,19 September 2007,
14,Broadcasting Amendment Bill (No 2)  Bill - government,,RA,19 September 2007,
15,Building Societies Amendment Bill  Bill - government,,RA,19 September 2007,
16,Care of Children Amendment Bill  Bill - government,,RA,19 September 2007,
17,Charitable Trusts Amendment Bill  Bill - government,,RA,19 September 2007,
18,"Children, Young Persons, and Their Families Amendment Bill (No 5)  Bill - government",,RA,19 September 2007,
19,Civil Union Amendment Bill  Bill - government,,RA,19 September 2007,
20,Companies Amendment Bill (No 3)  Bill - government,,RA,19 September 2007,
21,Cook Islands Amendment Bill  Bill - government,,RA,19 September 2007,
22,Corporations (Investigation and Management) Amendment Bill  Bill - government,,RA,19 September 2007,
23,Defence Amendment Bill (No 2)  Bill - government,,RA,19 September 2007,
24,Education Amendment Bill (No 2)  Bill - government,,RA,19 September 2007,
25,Electricity Amendment Bill (No 2)  Bill - government,,RA,19 September 2007,
26,"Energy (Fuels, Levies, and References) Amendment Bill  Bill - government",,RA,19 September 2007,
27,Engineering Associates Amendment Bill  Bill - government,,RA,19 September 2007,
28,Family Courts Amendment Bill  Bill - government,,RA,19 September 2007,
29,Fencing of Swimming Pools Amendment Bill  Bill - government,,RA,19 September 2007,
30,"Films, Videos, and Publications Classification Amendment Bill  Bill - government",,RA,19 September 2007,
31,Friendly Societies and Credit Unions Amendment Bill (No 2)  Bill - government,,RA,19 September 2007,
32,Gas Amendment Bill (No 2)  Bill - government,,RA,19 September 2007,
33,Hazardous Substances and New Organisms Amendment Bill  Bill - government,,RA,19 September 2007,
34,Health and Disability Commissioner Amendment Bill  Bill - government,,RA,19 September 2007,
35,Human Assisted Reproductive Technology Amendment Bill  Bill - government,,RA,19 September 2007,
36,Human Rights Amendment Bill  Bill - government,,RA,19 September 2007,
37,Industrial and Provident Societies Amendment Bill  Bill - government,,RA,19 September 2007,
38,Land Transport Amendment Bill (No 3)  Bill - government,,RA,19 September 2007,
39,Lawyers and Conveyancers Amendment Bill  Bill - government,,RA,19 September 2007,
40,Legal Services Amendment Bill (No 3)  Bill - government,,RA,19 September 2007,
41,Local Government Act 2002 Amendment Bill (No 2)  Bill - government,,RA,19 September 2007,
42,New Zealand Superannuation and Retirement Income Amendment Bill (No 2)  Bill - government,,RA,19 September 2007,
43,Niue Amendment Bill  Bill - government,,RA,19 September 2007,
44,Personal Property Securities Amendment Bill (No 2)  Bill - government,,RA,19 September 2007,
45,Privacy Amendment Bill (No 2)  Bill - government,,RA,19 September 2007,
46,Racing Amendment Bill (No 2)  Bill - government,,RA,19 September 2007,
47,Radiocommunications Amendment Bill (No 3)  Bill - government,,RA,19 September 2007,
48,Reserve Bank of New Zealand Amendment Bill (No 2)  Bill - government,,RA,19 September 2007,
49,Resource Management Amendment Bill  Bill - government,,RA,19 September 2007,
0,Retirement Villages Amendment Bill (No 2)  Bill - government,,RA,19 September 2007,
1,Securities Amendment Bill (No 2)  Bill - government,,RA,19 September 2007,
2,Securities Transfer Amendment Bill  Bill - government,,RA,19 September 2007,
3,Social Welfare (Transitional Provisions) Amendment Bill  Bill - government,,RA,19 September 2007,
4,State Sector Amendment Bill  Bill - government,,RA,19 September 2007,
5,Status of Children Amendment Bill  Bill - government,,RA,19 September 2007,
6,Tokelau Amendment Bill  Bill - government,,RA,19 September 2007,
7,Trade in Endangered Species Amendment Bill  Bill - government,,RA,19 September 2007,
8,Volunteers Employment Protection Amendment Bill  Bill - government,,RA,19 September 2007,
9,Independent Police Conduct Authority Amendment Bill  Bill - government,18-3,,11 September 2007,Law and Order Committee
10,Minimum Wage (New Entrants) Amendment Bill  Bill - member's,9-3,,11 September 2007,Transport and Industrial Relations Committee
11,Statutes Amendment Bill  Bill - government,107-2,3,11 September 2007,Government Administration Committee
12,Aviation Security Legislation Bill  Bill - government,110-2,3,11 September 2007,Transport and Industrial Relations Committee
13,Official Information (Openness of District Health Boards New Zealand) Amendment Bill  Bill - member's,77-1,W,05 September 2007,Health Committee
14,Wills Bill  Bill - government,78-3,RA,28 August 2007,Justice and Electoral Committee
15,Major Events Management Bill  Bill - government,99-2,RA,28 August 2007,Commerce Committee
16,Weathertight Homes Resolution Services (Remedies) Amendment Bill  Bill - government,123-3,RA,28 August 2007,Social Services Committee
17,Building (Consent Authorities) Amendment Bill  Bill - government,123-3A,RA,28 August 2007,
18,Farmers' Mutual Group Bill  Bill - private,116-2,RA,22 August 2007,Primary Production Committee
19,Animal Welfare (Restriction on Docking of Dogs' Tails) Bill  Bill - member's,169-1,CH,21 August 2007,Government Administration Committee
20,Mental Health Commission Amendment Bill  Bill - government,100-3,RA,17 August 2007,Health Committee
21,Appropriation (2007/08 Estimates) Bill  Bill - government,121-1,RA,17 August 2007,
22,Imprest Supply (Second for 2007/08) Bill  Bill - government,141-1,RA,17 August 2007,
23,Bail Amendment Bill  Bill - government,93-3B,RA,31 July 2007,
24,Prisoners' and Victims' Claims Amendment Bill  Bill - government,93-3E,RA,31 July 2007,
25,Sentencing Council Bill  Bill - government,93-3A,RA,31 July 2007,
26,Sentencing Amendment Bill (No 3)  Bill - government,93-3C,RA,31 July 2007,
27,Parole Amendment Bill (No 2)  Bill - government,93-3D,RA,31 July 2007,
28,Building (Late Consent is a Free Consent) Amendment Bill  Bill - member's,70-1,W,25 July 2007,Local Government and Environment Committee
29,Criminal Justice Reform Bill  Bill - government,93-2,3,19 July 2007,Justice and Electoral Committee
30,Evidence Amendment Bill  Bill - government,129-2,RA,03 July 2007,Justice and Electoral Committee
31,Appropriation (2006/07 Supplementary Estimates) Bill  Bill - government,122-1,RA,29 June 2007,
32,Imprest Supply (First for 2007/08) Bill  Bill - government,127-1,RA,29 June 2007,
33,State-Owned Enterprises (AgriQuality Limited and Asure New Zealand Limited) Bill  Bill - government,112-2,RA,26 June 2007,Commerce Committee
34,Social Security Amendment Bill  Bill - government,101-3,RA,23 June 2007,Social Services Committee
35,Kerikeri National Trust Bill  Bill - member's,115-1,W,13 June 2007,Local Government and Environment Committee
36,New Zealand Day Bill  Bill - member's,226-1,W,13 June 2007,Justice and Electoral Committee
37,Local Electoral (Repeal of Race-Based Representation) Amendment Bill  Bill - member's,84-1,W,13 June 2007,
38,Crimes (Substituted Section 59) Amendment Bill  Bill - member's,271-3,,21 May 2007,Justice and Electoral Committee
39,Social Security (Entitlement Cards) Amendment Bill  Bill - government,95-2,RA,21 May 2007,Social Services Committee
40,Taxation (KiwiSaver and Company Tax Rate Amendments) Bill  Bill - government,118-1,RA,21 May 2007,
41,Shop Trading Hours Act Repeal (Easter Trading) Amendment Bill  Bill - member's,51-2,W,16 May 2007,Commerce Committee
42,Immigration Advisers Licensing Bill  Bill - government,270-3,RA,04 May 2007,Transport and Industrial Relations Committee
43,Human Rights (Women in Armed Forces) Amendment Bill  Bill - government,76-2,RA,04 May 2007,"Foreign Affairs, Defence and Trade Committee"
44,Easter Sunday Shop Trading Amendment Bill  Bill - member's,42-2,W,02 May 2007,Commerce Committee
45,Justices of the Peace Amendment Bill  Bill - government,53-3,RA,14 April 2007,Law and Order Committee
46,Student Loan Scheme Amendment Bill (No 2)  Bill - government,92-2,RA,27 March 2007,Education and Science Committee
47,Disabled Persons Employment Promotion Repeal Bill  Bill - government,138-2A,RA,27 March 2007,
48,Minimum Wage Amendment Bill  Bill - government,138-2B,RA,27 March 2007,
49,Disabled Persons Employment Promotion (Repeal and Related Matters) Bill  Bill - government,138-1,3,20 March 2007,Social Services Committee
0,Agricultural Compounds and Veterinary Medicines Amendment Bill  Bill - government,,RA,15 March 2007,
1,Appropriation (2005/06 Financial Review) Bill  Bill - government,104-1,RA,15 March 2007,
2,Unsolicited Electronic Messages Bill  Bill - government,281-2,RA,05 March 2007,Commerce Committee
3,Customs and Excise Amendment Bill (No 2)  Bill - government,67-3,RA,05 March 2007,"Foreign Affairs, Defence and Trade Committee"
4,District Courts Amendment Bill (No 3)  Bill - government,90-2A,RA,05 March 2007,
5,Employment Relations Amendment Bill (No 2)  Bill - government,90-2B,RA,05 March 2007,
6,Judicature Amendment Bill (No 2)  Bill - government,90-2C,RA,05 March 2007,
7,Te Ture Whenua Maori Amendment Bill (No 2) / Maori Land Amendment Bill (No 2)  Bill - government,90-2D,RA,05 March 2007,
8,Coroners Act 1988 Amendment Bill  Bill - government,90-2E,RA,05 March 2007,
9,Coroners Act 2006 Amendment Bill  Bill - government,90-2F,RA,05 March 2007,
10,Land Transport Amendment Bill  Bill - government,112-2,RA,23 February 2007,Transport and Industrial Relations Committee
11,Parental Leave and Employment Protection (Paid Parental Leave for Self-Employed Persons) Amendment Bill  Bill - government,288-3,RA,23 February 2007,Transport and Industrial Relations Committee
12,Judicial Retirement Age Bill  Bill - government,90-1,3,23 February 2007,Justice and Electoral Committee
13,Telecommunications Amendment Bill  Bill - government,62-2,RA,18 December 2006,Finance and Expenditure Committee
14,Weathertight Homes Resolution Services Bill  Bill - government,75-2,,18 December 2006,Social Services Committee
15,Epidemic Preparedness Bill  Bill - government,39-3A,RA,18 December 2006,
16,Health Amendment Bill  Bill - government,39-3B,RA,18 December 2006,
17,Immigration Amendment Bill (No 2)  Bill - government,39-3C,RA,18 December 2006,
18,Parole Amendment Bill  Bill - government,39-3D,RA,18 December 2006,
19,Sentencing Amendment Bill (No 2)  Bill - government,39-3E,RA,18 December 2006,
20,Social Security Amendment Bill (No 2)  Bill - government,39-3F,RA,18 December 2006,
21,Summary Proceedings Amendment Bill (No 2)  Bill - government,39-3G,RA,18 December 2006,
22,Taxation (Savings Investment and Miscellaneous Provisions) Bill  Bill - government,,RA,18 December 2006,
23,Taxation (Annual Rates of Income Tax 2006-07) Bill  Bill - government,,RA,18 December 2006,
24,Health Amendment Bill  Bill - government,,RA,13 December 2006,
25,"Taxation (Annual Rates, Savings Investment, and Miscellaneous Provisions) Bill  Bill - government",48-2,3,12 December 2006,Finance and Expenditure Committee
26,Subordinate Legislation (Confirmation and Validation) Bill (No 2)  Bill - government,87-1,RA,12 December 2006,Regulations Review Committee
27,Te Ture Whenua Maori Amendment Bill / Maori Land Amendment Bill  Bill - government,55-3A,RA,12 December 2006,
28,Treaty of Waitangi Amendment Bill  Bill - government,55-3B,RA,12 December 2006,
29,Maori Fisheries Amendment Bill  Bill - government,55-3C,RA,12 December 2006,
30,Maori Commercial Aquaculture Claims Settlement Amendment Bill  Bill - government,55-3D,RA,12 December 2006,
31,Law Reform (Epidemic Preparedness) Bill  Bill - government,39-2,3,06 December 2006,Government Administration Committee
32,Māori Purposes Bill  Bill - government,55-2,3,06 December 2006,Māori Affairs Committee
33,Crimes (Intimate Covert Filming) Amendment Bill  Bill - government,257-2,RA,04 December 2006,Government Administration Committee
34,Evidence Bill  Bill - government,256-3,RA,04 December 2006,Justice and Electoral Committee
35,Crimes of Torture Amendment Bill  Bill - government,26-3,RA,04 December 2006,"Foreign Affairs, Defence and Trade Committee"
36,"Plumbers, Gasfitters, and Drainlayers Bill  Bill - government",269-3A,RA,04 December 2006,Commerce Committee
37,Electricity Amendment Bill  Bill - government,269-3B,RA,04 December 2006,
38,Gas Amendment Bill  Bill - government,269-3C,RA,04 December 2006,
39,Health and Safety in Employment Amendment Bill  Bill - government,269-3D,RA,04 December 2006,
40,Ministry of Energy (Abolition) Amendment Bill  Bill - government,269-3E,RA,04 December 2006,
41,Shop Trading Hours (Easter Trading Local Exemption) Bill  Bill - member's,168-1,W,23 November 2006,
42,Employment Relations (Probationary Employment) Amendment Bill  Bill - member's,24-1,W,22 November 2006,Transport and Industrial Relations Committee
43,Resource Management (Restricted Coastal Activities) Amendment Bill  Bill - member's,57-1,W,22 November 2006,
44,Energy Safety Review Bill  Bill - government,269-2,3,21 November 2006,Commerce Committee
45,Geographical Indications (Wine and Spirits) Registration Bill  Bill - government,278-3,RA,21 November 2006,"Foreign Affairs, Defence and Trade Committee"
46,Social Security (Long-term Residential Care) Amendment Bill  Bill - government,46-2,RA,21 November 2006,Social Services Committee
47,Ngāti Mutunga Claims Settlement Bill  Bill - government,65-2,RA,21 November 2006,Māori Affairs Committee
48,Insurance Companies' Deposits Amendment Bill  Bill - government,64-3E,RA,21 November 2006,
49,Companies Amendment Bill (No 2)  Bill - government,64-3A,RA,21 November 2006,
0,Dumping and Countervailing Duties Amendment Bill  Bill - government,64-3B,RA,21 November 2006,
1,Financial Reporting Amendment Bill  Bill - government,64-3C,RA,21 November 2006,
2,Friendly Societies and Credit Unions Amendment Bill  Bill - government,64-3D,RA,21 November 2006,
3,Business Law Reform Bill  Bill - government,64-2,3,14 November 2006,Commerce Committee
4,Climate Change Response Amendment Bill  Bill - government,258-3,RA,13 November 2006,Commerce Committee
5,Rotorua Library Trust Fund Variation Bill  Bill - local,54-1,RA,13 November 2006,Government Administration Committee
6,Electoral (Reduction in Number of Members of Parliament) Amendment Bill  Bill - member's,23-1,W,08 November 2006,Justice and Electoral Committee
7,Sale of Liquor (Youth Alcohol Harm Reduction: Purchase Age) Amendment Bill  Bill - member's,260-2A,W,08 November 2006,Law and Order Committee
8,Sports Anti-Doping Bill  Bill - government,285-3,RA,07 November 2006,Government Administration Committee
9,Insolvency Bill  Bill - government,14-3A,RA,07 November 2006,
10,Insolvency (Cross-border) Bill  Bill - government,14-3C,RA,07 November 2006,
11,Companies Amendment Bill  Bill - government,14-3B,RA,07 November 2006,
12,Residential Tenancies (Damage Insurance) Amendment Bill  Bill - member's,29-1,CH,06 November 2006,Social Services Committee
13,Reserve Bank of New Zealand Amendment Bill  Bill - government,63-3,RA,30 October 2006,Finance and Expenditure Committee
14,Racing Amendment Bill  Bill - government,63-3A,RA,30 October 2006,
15,Telecommunications Amendment Bill (No 2)  Bill - government,34-3A,RA,30 October 2006,
16,Radiocommunications Amendment Bill (No 2)  Bill - government,34-3B,RA,30 October 2006,
17,Insolvency Law Reform Bill  Bill - government,14-2,3,24 October 2006,Commerce Committee
18,Communications Legislation Bill  Bill - government,34-2,3,24 October 2006,Commerce Committee
19,Southland Agricultural and Pastoral Association Empowering Bill  Bill - private,73-1,RA,24 October 2006,Primary Production Committee
20,Securities Amendment Bill  Bill - government,234-3A,RA,24 October 2006,
21,Securities Markets Amendment Bill  Bill - government,234-3B,RA,24 October 2006,
22,Takeovers Amendment Bill  Bill - government,234-3C,RA,24 October 2006,
23,Fair Trading Amendment Bill  Bill - government,234-3D,RA,24 October 2006,
24,Appropriation (Parliamentary Expenditure Validation) Bill  Bill - government,88-1,RA,24 October 2006,
25,Manukau City Council (Control of Street Prostitution) Bill  Bill - local,6-1,W,11 October 2006,Local Government and Environment Committee
26,Securities Legislation Bill  Bill - government,234-2,3,10 October 2006,Commerce Committee
27,Child Support Amendment Bill (No 4)  Bill - government,282-2,RA,25 September 2006,Social Services Committee
28,Te Arawa Lakes Settlement Bill  Bill - government,25-2,RA,25 September 2006,Māori Affairs Committee
29,Standards Amendment Bill  Bill - government,276-2A,RA,25 September 2006,
30,Testing Laboratory Registration Amendment Bill  Bill - government,276-2B,RA,25 September 2006,
31,Standards and Conformance Bill  Bill - government,276-1,3,13 September 2006,Commerce Committee
32,Employment Relations Amendment Bill  Bill - government,19-3,RA,13 September 2006,Transport and Industrial Relations Committee
33,Westpac New Zealand Bill  Bill - private,31-2,RA,13 September 2006,Finance and Expenditure Committee
34,KiwiSaver Bill  Bill - government,21-3,RA,07 September 2006,Finance and Expenditure Committee
35,Meat Board Amendment Bill  Bill - government,30-2,RA,07 September 2006,Primary Production Committee
36,Education (Trustee Ineligibility) Amendment Bill  Bill - member's,197-1,W,06 September 2006,Education and Science Committee
37,Sex Offenders Registry Bill  Bill - member's,36-1,CH,05 September 2006,Justice and Electoral Committee
38,Coroners Bill  Bill - government,228-3,RA,29 August 2006,Justice and Electoral Committee
39,Human Rights (Gender Identity) Amendment Bill  Bill - member's,225-1,SC,23 August 2006,
40,Local Government (Rating Cap) Amendment Bill  Bill - member's,35-1,W,23 August 2006,
41,Protected Objects Amendment Bill  Bill - government,243-3,RA,09 August 2006,Government Administration Committee
42,Appropriation (2006/07 Estimates) Bill  Bill - government,49-1,RA,03 August 2006,
43,Imprest Supply (Second for 2006/07) Bill  Bill - government,68-1,RA,03 August 2006,
44,Gisborne District Council (Alfred Cox Park) Validation Bill  Bill - local,277-2,RA,02 August 2006,Local Government and Environment Committee
45,Criminal Proceeds and Instruments Bill  Bill - government,279-1,SC,12 July 2006,
46,Historic Places Amendment Bill  Bill - government,162-3,RA,30 June 2006,Government Administration Committee
47,Housing Restructuring and Tenancy Matters (Information Matching) Amendment Bill  Bill - government,8-3,RA,30 June 2006,Social Services Committee
48,Trustees Executors Limited Amendment Bill  Bill - private,16-2,RA,30 June 2006,Commerce Committee
49,New Zealand Superannuation and Retirement Income Amendment Bill  Bill - government,22-2A,RA,30 June 2006,
0,War Pensions Amendment Bill  Bill - government,22-2B,RA,30 June 2006,
1,Consumer's Right to Know (Food Information) Bill  Bill - member's,37-1,W,28 June 2006,
2,Human Rights (One Law For All) Amendment Bill  Bill - member's,60-1,W,28 June 2006,
3,Dog Control Amendment Bill  Bill - government,32-4A,RA,27 June 2006,
4,Litter Amendment Bill  Bill - government,32-4B,RA,27 June 2006,
5,Local Electoral Amendment Bill  Bill - government,32-4C,RA,27 June 2006,
6,Local Government Act 2002 Amendment Bill  Bill - government,32-4D,RA,27 June 2006,
7,Local Government Act 1974 Amendment Bill  Bill - government,32-4E,RA,27 June 2006,
8,Local Government (Rating) Amendment Bill  Bill - government,32-4F,RA,27 June 2006,
9,Rates Rebate Amendment Bill  Bill - government,32-4G,RA,27 June 2006,
10,Land Transport Amendment Bill (No 2)  Bill - government,32-4H,RA,27 June 2006,
11,Appropriation (2005/06 Supplementary Estimates) Bill  Bill - government,50-1,RA,22 June 2006,
12,Imprest Supply (First for 2006/07) Bill  Bill - government,61-1,RA,22 June 2006,
13,Local Government Law Reform Bill  Bill - government,32-3,3,21 June 2006,Local Government and Environment Committee
14,Resource Management (Security for Costs) Amendment Bill  Bill - member's,47-1,W,14 June 2006,
